{
  "moduleId": "V4",
  "moduleVersion": "0.1.0",
  "sourceHash": "sha256:fb22b1fed3a17541c0de9d7b90a0d8c297def1cb9433da988e3d00a45b33c700",
  "contractHash": "sha256:3775d824cd1eb2673017b7e8d89259bdc9730e6168fc2e49d83f5f06edcd8c1b",
  "dependencyVersions": {
    "V0": "0.1.0",
    "V1": "0.1.0",
    "V2": "0.1.0",
    "V3": "0.1.0"
  },
  "dependencyContracts": {
    "V0": "sha256:8d2237a0f23d4ec78fd85d789a366b7acfcb7317fd47dab8b85d920ac330d134",
    "V1": "sha256:f21bdd83c19cabab32eb73cda4940d62a39433707e9b1ffc9505293c225c2511",
    "V2": "sha256:5a5af978beb155b9114bc64bb78860d003d9821d70460005d69be79d48384f5a",
    "V3": "sha256:17d10bb057dc9f73885d69b10d01fae2fa229990883ebc276025968c6905db26"
  },
  "staticCheck": {
    "passed": true,
    "command": "pnpm run typecheck"
  },
  "unitTests": {
    "passed": 47,
    "failed": 0
  },
  "propertyTests": {
    "seeds": 500,
    "invariantViolations": 0,
    "passed": 5
  },
  "integrationTests": {
    "passed": 15,
    "failed": 0
  },
  "labScenarios": {
    "board_shows_the_v_phase_completion_screen": "passed",
    "dependency_contract_change_blocks_dependents": "passed",
    "evidence_cannot_claim_status_above_gates": "passed",
    "evidence_is_reproducible_from_the_same_measurements": "passed",
    "gates_decide_status": "passed",
    "invalidation_propagates_through_the_chain": "passed",
    "replay_mismatch_fails_determinism_gate": "passed",
    "verified_without_slice_is_refused": "passed"
  },
  "replay": {
    "runs": 20,
    "uniqueHashes": 1
  },
  "integrationSlices": {
    "VS0": "pending — K0~K3 미구현 (원문 「20」 VS0)"
  },
  "gates": [
    {
      "id": "G0",
      "name": "목적 게이트",
      "measured": true,
      "passed": true,
      "detail": "목적 1문장"
    },
    {
      "id": "G1",
      "name": "계약 게이트",
      "measured": true,
      "passed": true,
      "detail": "입력 3 · 출력 3 · 소유 상태 evidence_store, module_status · 불변조건 9"
    },
    {
      "id": "G2",
      "name": "단위 게이트",
      "measured": true,
      "passed": true,
      "detail": "단위 47통과/0실패"
    },
    {
      "id": "G3",
      "name": "속성 게이트",
      "measured": true,
      "passed": true,
      "detail": "표본 500 · 위반 0"
    },
    {
      "id": "G4",
      "name": "직관 게이트",
      "measured": true,
      "passed": true,
      "detail": "장면 8개"
    },
    {
      "id": "G5",
      "name": "결정성 게이트",
      "measured": true,
      "passed": true,
      "detail": "20회 재실행 · 해시 1종"
    },
    {
      "id": "G6",
      "name": "통합 게이트",
      "measured": true,
      "passed": false,
      "detail": "슬라이스 1개 · 미통과 VS0"
    },
    {
      "id": "G7",
      "name": "회귀 게이트",
      "measured": false,
      "passed": false,
      "detail": "회귀 측정 없음"
    },
    {
      "id": "G8",
      "name": "증거 게이트",
      "measured": true,
      "passed": true,
      "detail": "정적 검사 통과 · 코드 해시 sha256:fb22b1f…"
    }
  ],
  "status": "LAB_PASS",
  "issuedAtTick": 0,
  "producedBy": "tools/verify.mjs → V4 evidence-gate"
}
