{
  "moduleId": "S0",
  "moduleVersion": "0.1.0",
  "sourceHash": "sha256:ebf357184ff15404a2663a9f34dea3ebce4d8e567e6226140f36ca797080bc02",
  "contractHash": "sha256:138a502cc1019cfda1a156b9ee6323e75d3febd9100e8fb763f85f8446352799",
  "dependencyVersions": {
    "K0": "0.1.0",
    "K1": "0.1.0",
    "K2": "0.1.0",
    "V0": "0.1.0"
  },
  "dependencyContracts": {
    "K0": "sha256:ef98188281712b58fe8ee3290ba967cd730e967062d947c0cee567f275bb87eb",
    "K1": "sha256:f6944171b04e3b878b408bf7f9b8d5351b4607de92cd3c06681195a858a8c696",
    "K2": "sha256:08da60ed3ae14282b397542ef053ae499010448efbdbbd62023d26b05945dd00",
    "V0": "sha256:8d2237a0f23d4ec78fd85d789a366b7acfcb7317fd47dab8b85d920ac330d134"
  },
  "staticCheck": {
    "passed": true,
    "command": "pnpm run typecheck"
  },
  "unitTests": {
    "passed": 43,
    "failed": 0
  },
  "propertyTests": {
    "seeds": 600,
    "invariantViolations": 0,
    "passed": 13
  },
  "integrationTests": {
    "passed": 13,
    "failed": 0
  },
  "labScenarios": {
    "capability_and_condition_are_separate_refusals": "passed",
    "estimated_cost_carries_the_travel": "passed",
    "path_goes_around_the_wall": "passed",
    "reach_needs_a_clear_line_not_just_distance": "passed",
    "resolution_leaves_the_world_untouched": "passed",
    "spatial_index_agrees_with_full_scan": "passed",
    "wall_blocks_the_relic_until_the_door_opens": "passed"
  },
  "replay": {
    "runs": 20,
    "uniqueHashes": 1
  },
  "integrationSlices": {},
  "regression": {
    "failures": 0
  },
  "gates": [
    {
      "id": "G0",
      "name": "목적 게이트",
      "measured": true,
      "passed": true,
      "detail": "목적 1문장"
    },
    {
      "id": "G1",
      "name": "계약 게이트",
      "measured": true,
      "passed": true,
      "detail": "입력 4 · 출력 4 · 소유 상태 spatial_index, navigation_grid · 불변조건 9"
    },
    {
      "id": "G2",
      "name": "단위 게이트",
      "measured": true,
      "passed": true,
      "detail": "단위 43통과/0실패"
    },
    {
      "id": "G3",
      "name": "속성 게이트",
      "measured": true,
      "passed": true,
      "detail": "표본 600 · 위반 0"
    },
    {
      "id": "G4",
      "name": "직관 게이트",
      "measured": true,
      "passed": true,
      "detail": "장면 7개"
    },
    {
      "id": "G5",
      "name": "결정성 게이트",
      "measured": true,
      "passed": true,
      "detail": "20회 재실행 · 해시 1종"
    },
    {
      "id": "G6",
      "name": "통합 게이트",
      "measured": false,
      "passed": false,
      "detail": "지정된 수직 통합 시나리오 기록이 없다"
    },
    {
      "id": "G7",
      "name": "회귀 게이트",
      "measured": true,
      "passed": true,
      "detail": "기존 시나리오 실패 0건"
    },
    {
      "id": "G8",
      "name": "증거 게이트",
      "measured": true,
      "passed": true,
      "detail": "정적 검사 통과 · 코드 해시 sha256:ebf3571…"
    }
  ],
  "status": "LAB_PASS",
  "issuedAtTick": 0,
  "producedBy": "tools/verify.mjs → V4 evidence-gate"
}
